{
  "$schema": "https://json-schema.org/draft/2020-12/schema",
  "$id": "https://example.local/schemas/synchropage.lecture.page_batch.v1.schema.json",
  "title": "SynchroPage Lecture Page Batch",
  "type": "object",
  "additionalProperties": false,
  "required": [
    "schema",
    "document_id",
    "target_pages",
    "pages"
  ],
  "properties": {
    "schema": {
      "const": "synchropage.lecture.page_batch.v1"
    },
    "document_id": {
      "type": "string"
    },
    "target_pages": {
      "type": "array",
      "minItems": 1,
      "items": {
        "type": "integer",
        "minimum": 1
      }
    },
    "pages": {
      "type": "array",
      "minItems": 1,
      "items": {
        "$ref": "#/$defs/page"
      }
    }
  },
  "$defs": {
    "page": {
      "type": "object",
      "additionalProperties": false,
      "required": [
        "page_no",
        "source",
        "teaching",
        "status"
      ],
      "properties": {
        "page_no": {
          "type": "integer",
          "minimum": 1
        },
        "source": {
          "type": "object",
          "additionalProperties": false,
          "required": [
            "pdf_page_ref",
            "text_md",
            "ocr_used",
            "parser",
            "page_type"
          ],
          "properties": {
            "pdf_page_ref": {
              "type": "string"
            },
            "text_md": {
              "type": "string"
            },
            "ocr_used": {
              "type": "boolean"
            },
            "parser": {
              "type": "string"
            },
            "text_garbled": {
              "type": "boolean",
              "description": "The extracted text layer is unreadable (formulas drawn with an embedded font came out as stray symbols)."
            },
            "page_type": {
              "type": "string",
              "enum": [
                "title",
                "agenda",
                "concept",
                "example",
                "figure",
                "table",
                "formula",
                "exercise",
                "summary",
                "blank",
                "unknown"
              ]
            }
          }
        },
        "teaching": {
          "type": "object",
          "additionalProperties": false,
          "required": [
            "slide_title",
            "speaker_notes_md",
            "concepts",
            "prerequisites",
            "contextual_bridge",
            "visual_explanations",
            "formula_explanations",
            "evidence",
            "confidence",
            "needs_review",
            "needs_parser_fallback"
          ],
          "properties": {
            "slide_title": {
              "type": "string"
            },
            "question": {
              "type": "string",
              "description": "The think-first question: shown before the explanation for the student to try from the slide alone; the point is its answer. Empty on skim pages."
            },
            "point": {
              "type": "string",
              "description": "The one claim the student must take away from this page; the explanation opens with it."
            },
            "speaker_notes_md": {
              "type": "string"
            },
            "concepts": {
              "type": "array",
              "items": {
                "type": "string"
              }
            },
            "prerequisites": {
              "type": "array",
              "items": {
                "type": "string"
              }
            },
            "contextual_bridge": {
              "type": "string"
            },
            "visual_explanations": {
              "type": "array",
              "items": {
                "type": "string"
              }
            },
            "formula_explanations": {
              "type": "array",
              "items": {
                "type": "string"
              }
            },
            "stuck_points": {
              "description": "Where a learner typically gets stuck on this page, each resolved in one line.",
              "type": "array",
              "items": {
                "type": "string"
              }
            },
            "exam_angles": {
              "description": "How an exam would test this page: question forms, traps, what graders look for.",
              "type": "array",
              "items": {
                "type": "string"
              }
            },
            "generation_error": {
              "description": "Why the last generation attempt for this page failed (transport or quality). Written by the reader; absent on successful pages.",
              "type": "object",
              "additionalProperties": false,
              "properties": {
                "kind": {
                  "type": "string",
                  "enum": [
                    "timeout",
                    "rate_limit",
                    "network",
                    "invalid_json",
                    "truncated",
                    "server",
                    "quality"
                  ]
                },
                "attempts": {
                  "type": "integer",
                  "minimum": 0
                },
                "at": {
                  "type": "number"
                }
              },
              "required": [
                "kind",
                "attempts",
                "at"
              ]
            },
            "evidence": {
              "type": "array",
              "minItems": 1,
              "items": {
                "type": "object",
                "additionalProperties": false,
                "required": [
                  "kind",
                  "quote_or_reference"
                ],
                "properties": {
                  "kind": {
                    "type": "string",
                    "enum": [
                      "title",
                      "keyword",
                      "formula",
                      "figure",
                      "table",
                      "caption",
                      "layout",
                      "other"
                    ]
                  },
                  "quote_or_reference": {
                    "type": "string"
                  }
                }
              }
            },
            "confidence": {
              "type": "number",
              "minimum": 0,
              "maximum": 1
            },
            "needs_review": {
              "type": "boolean"
            },
            "needs_parser_fallback": {
              "type": "boolean"
            },
            "handoff": {
              "type": "string",
              "description": "One or two sentences on what the student holds after this page; the next page's request receives it."
            }
          }
        },
        "status": {
          "type": "string",
          "enum": [
            "queued",
            "running",
            "ready",
            "needs_review",
            "failed"
          ]
        }
      }
    }
  }
}
